{
  "plan_path": "docs/plans/2026-08-30-local-endpoint-dispatch.plan.md",
  "plan_content_hash": "e3b0c44298fc1c149afbf4c8996fb92427ae41e4649b934ca495991b7852b855",
  "invocation_flags": {
    "phase_mode": "stop",
    "phasing_enabled": false
  },
  "backend": "subagent",
  "verify_mode": "per-wave",
  "tdd_enabled": false,
  "phases": [
    {
      "phase_id": 1,
      "wave_range": "1-3",
      "status": "complete",
      "directory": "docs/plan-runner/2026-09-01/cycle-1",
      "last_completed_wave": 3
    }
  ],
  "overall_status": "complete",
  "updated_at": "2026-09-01T00:00:00Z",
  "model_policy": {
    "resolved": {
      "dev": {"model": "local-llm-70b", "source": "yml"},
      "test-author": {"model": "local-llm-70b", "source": "yml"},
      "verifier": {"model": "claude-sonnet-5", "source": "default"}
    },
    "endpoint": {
      "base_url": "http://localhost:8000",
      "api_key_env": "LOCAL_LLM_API_KEY",
      "health": "reachable",
      "roles": ["dev", "test-author"],
      "health_by_phase": [
        {"phase_id": 1, "health": "reachable"}
      ],
      "dispatch_by_role": {
        "dev": "endpoint",
        "test-author": "endpoint",
        "verifier": "host_subagent"
      }
    },
    "consent": "auto",
    "substitutions": []
  }
}
