{
  "plan_path": "docs/plans/2026-07-16-large-plan.md",
  "plan_content_hash": "e3b0c44298fc1c149afbf4c8996fb92427ae41e4649b934ca495991b7852b855",
  "invocation_flags": {
    "phase_size": 4,
    "phase_mode": "relay",
    "phasing_enabled": true,
    "no_phasing": false
  },
  "backend": "subagent",
  "verify_mode": "per-wave",
  "tdd_enabled": false,
  "phases": [
    {
      "phase_id": 1,
      "wave_range": "1-4",
      "status": "complete",
      "directory": "docs/plan-runner/2026-07-16/cycle-1/phase-1",
      "last_completed_wave": 4
    },
    {
      "phase_id": 2,
      "wave_range": "5-8",
      "status": "in_progress",
      "directory": "docs/plan-runner/2026-07-16/cycle-1/phase-2",
      "last_completed_wave": 6
    },
    {
      "phase_id": 3,
      "wave_range": "9-12",
      "status": "pending",
      "directory": "docs/plan-runner/2026-07-16/cycle-1/phase-3",
      "last_completed_wave": null
    }
  ],
  "overall_status": "active",
  "updated_at": "2026-07-16T14:23:45.123Z",
  "dag": {
    "mode": "dag",
    "base_ref": "4a1b2c3d",
    "integration_branch": "plan-runner/cycle-1",
    "branch_owned": true,
    "events_path": "docs/plan-runner/2026-07-16/cycle-1/events.jsonl",
    "max_integrations_per_phase": 4,
    "integrations_completed": 1,
    "resume_task_id": "dag-execution-t02",
    "stop_reason": "integration boundary reached",
    "tasks": [
      {
        "task_id": "dag-execution-t01",
        "depends_on": [],
        "status": "integrated",
        "attempts": 1,
        "base_commit": "4a1b2c3d",
        "produced_commit": "5b2c3d4e",
        "integrated_commit": "6c3d4e5f",
        "worktree_path": null,
        "verification_artifacts": ["verification/dag-execution-t01.json"],
        "block_reason": null
      },
      {
        "task_id": "dag-execution-t02",
        "depends_on": ["dag-execution-t01"],
        "status": "retrying",
        "attempts": 1,
        "base_commit": "6c3d4e5f",
        "produced_commit": null,
        "integrated_commit": null,
        "worktree_path": "C:/temp/plan-runner/dag-execution-t02",
        "verification_artifacts": ["verification/dag-execution-t02-attempt-1.json"],
        "block_reason": null
      }
    ]
  }
}
